{
  "$schema": "http://json-schema.org/draft-07/schema#",
  "title": "TableTemplate",
  "type": "object",
  "required": ["type", "title", "columns", "rows"],
  "properties": {
    "type": { "const": "table" },
    "title": { "type": "string" },
    "columns": {
      "type": "array",
      "items": {
        "type": "object",
        "required": ["key", "label"],
        "properties": {
          "key": { "type": "string" },
          "label": { "type": "string" },
          "format": { "type": "string", "enum": ["text", "number", "currency", "percent", "date"] }
        }
      }
    },
    "rows": {
      "type": "array",
      "items": { "type": "object" }
    },
    "meta": {
      "type": "object",
      "properties": {
        "source_query": { "type": "string" },
        "generated_at": { "type": "string", "format": "date-time" },
        "row_count": { "type": "integer" }
      }
    }
  }
}
