{
  "type": "table",
  "title": "รายชื่อโครงการของคณะเทคโนโลยีสารสนเทศและการสื่อสาร ปีงบประมาณ 2569",
  "columns": [
    { "key": "code", "label": "รหัสโครงการ", "format": "text" },
    { "key": "name", "label": "ชื่อโครงการ", "format": "text" },
    { "key": "planned", "label": "งบประมาณต้นปี", "format": "currency" },
    { "key": "actual", "label": "งบที่ใช้ไป", "format": "currency" }
  ],
  "rows": [
    { "code": "694101033", "name": "โครงการ Comp camp สัญจร", "planned": 350000, "actual": 302490.00 },
    { "code": "694101034", "name": "โครงการ ICT Open House", "planned": 200000, "actual": 0.00 },
    { "code": "694101035", "name": "โครงการ Show Case ICT Festival", "planned": 80000, "actual": 0.00 },
    { "code": "694101036", "name": "โครงการแข่งขันกีฬาบุคลากร คณะฯ", "planned": 20000, "actual": 9159.00 },
    { "code": "694101037", "name": "โครงการจัดการความรู้เพื่อพัฒนาองค์กร (ICT KM)", "planned": 100000, "actual": 30000.00 },
    { "code": "694101038", "name": "โครงการตรวจติดตามและการประกันคุณภาพการศึกษา", "planned": 180000, "actual": 180000.00 },
    { "code": "694101039", "name": "โครงการปฐมนิเทศนิสิตใหม่และพบผู้ปกครอง", "planned": 60000, "actual": 60000.00 },
    { "code": "694101040", "name": "โครงการปัจฉิมนิเทศนิสิต", "planned": 70000, "actual": 56950.00 },
    { "code": "694101041", "name": "โครงการพัฒนาทักษะด้าน Soft Skill", "planned": 220000, "actual": 220000.00 },
    { "code": "694101042", "name": "โครงการพัฒนาศักยภาพของพนักงานสายสนับสนุน", "planned": 20000, "actual": 0.00 },
    { "code": "694101043", "name": "โครงการพัฒนาอาจารย์เชี่ยวชาญวิชาการฯ", "planned": 50000, "actual": 10060.00 },
    { "code": "694101044", "name": "โครงการพิธีรับปริญญาบัตรคณะฯ", "planned": 150000, "actual": 147354.00 },
    { "code": "694101045", "name": "โครงการศิษย์เก่าคณะ ICT สัมพันธ์", "planned": 100000, "actual": 0.00 },
    { "code": "694101046", "name": "โครงการส่งเสริมกิจกรรมของผู้นำนิสิตคณะฯ", "planned": 700000, "actual": 672053.00 },
    { "code": "694101047", "name": "โครงการส่งเสริมคุณธรรมและความโปร่งใสในการดำเนินงาน (ITA)", "planned": 20000, "actual": 0.00 },
    { "code": "694101048", "name": "โครงการส่งเสริมผลการเรียนรู้ฯ สาขาคอมพิวเตอร์กราฟิกและมัลติมีเดีย", "planned": 138320, "actual": 53502.00 },
    { "code": "694101049", "name": "โครงการส่งเสริมผลการเรียนรู้ฯ สาขาเทคโนโลยีสารสนเทศ", "planned": 89600, "actual": 109500.00 },
    { "code": "694101050", "name": "โครงการส่งเสริมผลการเรียนรู้ฯ สาขาธุรกิจดิจิทัล", "planned": 83600, "actual": 63932.58 },
    { "code": "694101051", "name": "โครงการส่งเสริมผลการเรียนรู้ฯ สาขาภูมิสารสนเทศศาสตร์", "planned": 91880, "actual": 101880.00 },
    { "code": "694101052", "name": "โครงการส่งเสริมผลการเรียนรู้ฯ สาขาวิทยาการข้อมูลและการประยุกต์", "planned": 19600, "actual": 19600.00 },
    { "code": "694101053", "name": "โครงการส่งเสริมผลการเรียนรู้ฯ สาขาวิทยาการคอมพิวเตอร์", "planned": 31000, "actual": 21000.00 },
    { "code": "694101054", "name": "โครงการส่งเสริมผลการเรียนรู้ฯ สาขาวิศวกรรมคอมพิวเตอร์", "planned": 184110, "actual": 70600.00 },
    { "code": "694101055", "name": "โครงการส่งเสริมผลการเรียนรู้ฯ สาขาวิศวกรรมซอฟต์แวร์", "planned": 84900, "actual": 33400.00 },
    { "code": "694101056", "name": "โครงการส่งเสริมสำนักงานสีเขียว (Green Office)", "planned": 100000, "actual": 35340.00 },
    { "code": "694101057", "name": "โครงการส่งเสริมสุขภาพบุคลากร", "planned": 50000, "actual": 39291.00 },
    { "code": "694101058", "name": "โครงการสร้างเครือข่ายระหว่างคณะและสถานประกอบการฯ", "planned": 284560, "actual": 81080.00 },
    { "code": "694101059", "name": "โครงการสัมมนาจัดทำแผนยุทธศาสตร์เพื่อการพัฒนาคณะ", "planned": 700000, "actual": 404995.82 },
    { "code": "694101060", "name": "โครงการเสริมสร้างกำลังใจและความผูกพันของบุคลากร", "planned": 60000, "actual": 0.00 },
    { "code": "694101061", "name": "โครงการเสริมสร้างความรู้ด้านการประกันคุณภาพฯ (EdPEx)", "planned": 50000, "actual": 26300.00 },
    { "code": "694103008", "name": "โครงการ ICT สืบสานลอยประทีปล้านนา", "planned": 70000, "actual": 0.00 },
    { "code": "694103009", "name": "โครงการถวายเทียนพรรษา ICT", "planned": 20000, "actual": 19891.30 },
    { "code": "694103010", "name": "โครงการทำบุญคณะและบายศรีสู่ขวัญ", "planned": 50000, "actual": 48279.00 },
    { "code": "694103011", "name": "โครงการสืบสานประเพณีสงกรานต์", "planned": 50000, "actual": 50000.00 },
    { "code": "694104007", "name": "โครงการพัฒนาศักยภาพนักวิจัยคณะฯ", "planned": 200000, "actual": 30100.00 },
    { "code": "694104008", "name": "ทุนสนับสนุนการวิจัย", "planned": 450000, "actual": 807550.00 },
    { "code": "694104087", "name": "โครงการบูรณาการเทคโนโลยีโบราณดาราศาสตร์ฯ กว๊านพะเยา", "planned": 0, "actual": 990000.00 },
    { "code": "694105002", "name": "โครงการเสริมศักยภาพชุมชนฯ ด้านเทคโนโลยีดิจิทัล", "planned": 300000, "actual": 227886.55 },
    { "code": "694105068", "name": "โครงการพัฒนาศักยภาพด้าน AI Literacy และ Generative AI", "planned": 0, "actual": 71420.00 }
  ],
  "meta": {
    "source_query": "SELECT code, name, planned, actual FROM projects WHERE fiscal_year = 2569 AND faculty = 'ICT'",
    "generated_at": "2026-08-25T00:00:00+07:00",
    "row_count": 38
  }
}
